{
  "schema_version": "devstone-hla-workload/v1",
  "generator": {
    "name": "gorti-devstone-hla-workload",
    "version": "1.1.0"
  },
  "benchmark": {
    "requested_spelling": "DEVSOne",
    "resolved_name": "DEVStone",
    "topology_definition": "HI",
    "profile": "DEVStone-HLA workload mapping",
    "scope": "HLA application-traffic workload; not a DEVS simulator-kernel benchmark result"
  },
  "configuration": {
    "topology": "HI",
    "width": 10,
    "depth": 10,
    "external_event_count": 100,
    "seed": 1516,
    "synthetic_transition_delay": {
      "external_seconds": 0,
      "internal_seconds": 0
    }
  },
  "hla_mapping": {
    "profile_version": "devstone-hla/v1",
    "delivery_plan_format": "DVSHLA1",
    "participants": [
      "producer",
      "consumer"
    ],
    "atomic_node_mapping": "logical workload entity",
    "delivery_mapping": "one receive-order object update and one receive-order interaction per atomic event-value delivery",
    "projection_deliveries_per_atomic_event_value": 2,
    "payload_bytes_per_channel": 8,
    "object_attribute_fields": [
      "delivery_ordinal",
      "payload"
    ],
    "interaction_fields": [
      "injected_event_id",
      "target_atomic_node_id",
      "delivery_ordinal",
      "payload"
    ],
    "materialization_order": [
      "injected_event.sequence",
      "atomic_nodes document order",
      "occurrence_ordinal"
    ]
  },
  "event_semantics": {
    "injection_interval_logical_time": 1,
    "input_fanout": "each atomic node receives each injected event once",
    "li_forwarding": "no internal atomic-to-atomic coupling",
    "hi_forwarding": "each regular-level atomic forwards every received event value to its next atomic",
    "transition_delay_seconds": 0
  },
  "atomic_nodes": [
    {
      "id": "l0000.a0001",
      "kind": "devstone_atomic",
      "level": 0,
      "index": 1,
      "ports": {
        "input": "in",
        "output": "out"
      }
    },
    {
      "id": "l0000.a0002",
      "kind": "devstone_atomic",
      "level": 0,
      "index": 2,
      "ports": {
        "input": "in",
        "output": "out"
      }
    },
    {
      "id": "l0000.a0003",
      "kind": "devstone_atomic",
      "level": 0,
      "index": 3,
      "ports": {
        "input": "in",
        "output": "out"
      }
    },
    {
      "id": "l0000.a0004",
      "kind": "devstone_atomic",
      "level": 0,
      "index": 4,
      "ports": {
        "input": "in",
        "output": "out"
      }
    },
    {
      "id": "l0000.a0005",
      "kind": "devstone_atomic",
      "level": 0,
      "index": 5,
      "ports": {
        "input": "in",
        "output": "out"
      }
    },
    {
      "id": "l0000.a0006",
      "kind": "devstone_atomic",
      "level": 0,
      "index": 6,
      "ports": {
        "input": "in",
        "output": "out"
      }
    },
    {
      "id": "l0000.a0007",
      "kind": "devstone_atomic",
      "level": 0,
      "index": 7,
      "ports": {
        "input": "in",
        "output": "out"
      }
    },
    {
      "id": "l0000.a0008",
      "kind": "devstone_atomic",
      "level": 0,
      "index": 8,
      "ports": {
        "input": "in",
        "output": "out"
      }
    },
    {
      "id": "l0000.a0009",
      "kind": "devstone_atomic",
      "level": 0,
      "index": 9,
      "ports": {
        "input": "in",
        "output": "out"
      }
    },
    {
      "id": "l0001.a0001",
      "kind": "devstone_atomic",
      "level": 1,
      "index": 1,
      "ports": {
        "input": "in",
        "output": "out"
      }
    },
    {
      "id": "l0001.a0002",
      "kind": "devstone_atomic",
      "level": 1,
      "index": 2,
      "ports": {
        "input": "in",
        "output": "out"
      }
    },
    {
      "id": "l0001.a0003",
      "kind": "devstone_atomic",
      "level": 1,
      "index": 3,
      "ports": {
        "input": "in",
        "output": "out"
      }
    },
    {
      "id": "l0001.a0004",
      "kind": "devstone_atomic",
      "level": 1,
      "index": 4,
      "ports": {
        "input": "in",
        "output": "out"
      }
    },
    {
      "id": "l0001.a0005",
      "kind": "devstone_atomic",
      "level": 1,
      "index": 5,
      "ports": {
        "input": "in",
        "output": "out"
      }
    },
    {
      "id": "l0001.a0006",
      "kind": "devstone_atomic",
      "level": 1,
      "index": 6,
      "ports": {
        "input": "in",
        "output": "out"
      }
    },
    {
      "id": "l0001.a0007",
      "kind": "devstone_atomic",
      "level": 1,
      "index": 7,
      "ports": {
        "input": "in",
        "output": "out"
      }
    },
    {
      "id": "l0001.a0008",
      "kind": "devstone_atomic",
      "level": 1,
      "index": 8,
      "ports": {
        "input": "in",
        "output": "out"
      }
    },
    {
      "id": "l0001.a0009",
      "kind": "devstone_atomic",
      "level": 1,
      "index": 9,
      "ports": {
        "input": "in",
        "output": "out"
      }
    },
    {
      "id": "l0002.a0001",
      "kind": "devstone_atomic",
      "level": 2,
      "index": 1,
      "ports": {
        "input": "in",
        "output": "out"
      }
    },
    {
      "id": "l0002.a0002",
      "kind": "devstone_atomic",
      "level": 2,
      "index": 2,
      "ports": {
        "input": "in",
        "output": "out"
      }
    },
    {
      "id": "l0002.a0003",
      "kind": "devstone_atomic",
      "level": 2,
      "index": 3,
      "ports": {
        "input": "in",
        "output": "out"
      }
    },
    {
      "id": "l0002.a0004",
      "kind": "devstone_atomic",
      "level": 2,
      "index": 4,
      "ports": {
        "input": "in",
        "output": "out"
      }
    },
    {
      "id": "l0002.a0005",
      "kind": "devstone_atomic",
      "level": 2,
      "index": 5,
      "ports": {
        "input": "in",
        "output": "out"
      }
    },
    {
      "id": "l0002.a0006",
      "kind": "devstone_atomic",
      "level": 2,
      "index": 6,
      "ports": {
        "input": "in",
        "output": "out"
      }
    },
    {
      "id": "l0002.a0007",
      "kind": "devstone_atomic",
      "level": 2,
      "index": 7,
      "ports": {
        "input": "in",
        "output": "out"
      }
    },
    {
      "id": "l0002.a0008",
      "kind": "devstone_atomic",
      "level": 2,
      "index": 8,
      "ports": {
        "input": "in",
        "output": "out"
      }
    },
    {
      "id": "l0002.a0009",
      "kind": "devstone_atomic",
      "level": 2,
      "index": 9,
      "ports": {
        "input": "in",
        "output": "out"
      }
    },
    {
      "id": "l0003.a0001",
      "kind": "devstone_atomic",
      "level": 3,
      "index": 1,
      "ports": {
        "input": "in",
        "output": "out"
      }
    },
    {
      "id": "l0003.a0002",
      "kind": "devstone_atomic",
      "level": 3,
      "index": 2,
      "ports": {
        "input": "in",
        "output": "out"
      }
    },
    {
      "id": "l0003.a0003",
      "kind": "devstone_atomic",
      "level": 3,
      "index": 3,
      "ports": {
        "input": "in",
        "output": "out"
      }
    },
    {
      "id": "l0003.a0004",
      "kind": "devstone_atomic",
      "level": 3,
      "index": 4,
      "ports": {
        "input": "in",
        "output": "out"
      }
    },
    {
      "id": "l0003.a0005",
      "kind": "devstone_atomic",
      "level": 3,
      "index": 5,
      "ports": {
        "input": "in",
        "output": "out"
      }
    },
    {
      "id": "l0003.a0006",
      "kind": "devstone_atomic",
      "level": 3,
      "index": 6,
      "ports": {
        "input": "in",
        "output": "out"
      }
    },
    {
      "id": "l0003.a0007",
      "kind": "devstone_atomic",
      "level": 3,
      "index": 7,
      "ports": {
        "input": "in",
        "output": "out"
      }
    },
    {
      "id": "l0003.a0008",
      "kind": "devstone_atomic",
      "level": 3,
      "index": 8,
      "ports": {
        "input": "in",
        "output": "out"
      }
    },
    {
      "id": "l0003.a0009",
      "kind": "devstone_atomic",
      "level": 3,
      "index": 9,
      "ports": {
        "input": "in",
        "output": "out"
      }
    },
    {
      "id": "l0004.a0001",
      "kind": "devstone_atomic",
      "level": 4,
      "index": 1,
      "ports": {
        "input": "in",
        "output": "out"
      }
    },
    {
      "id": "l0004.a0002",
      "kind": "devstone_atomic",
      "level": 4,
      "index": 2,
      "ports": {
        "input": "in",
        "output": "out"
      }
    },
    {
      "id": "l0004.a0003",
      "kind": "devstone_atomic",
      "level": 4,
      "index": 3,
      "ports": {
        "input": "in",
        "output": "out"
      }
    },
    {
      "id": "l0004.a0004",
      "kind": "devstone_atomic",
      "level": 4,
      "index": 4,
      "ports": {
        "input": "in",
        "output": "out"
      }
    },
    {
      "id": "l0004.a0005",
      "kind": "devstone_atomic",
      "level": 4,
      "index": 5,
      "ports": {
        "input": "in",
        "output": "out"
      }
    },
    {
      "id": "l0004.a0006",
      "kind": "devstone_atomic",
      "level": 4,
      "index": 6,
      "ports": {
        "input": "in",
        "output": "out"
      }
    },
    {
      "id": "l0004.a0007",
      "kind": "devstone_atomic",
      "level": 4,
      "index": 7,
      "ports": {
        "input": "in",
        "output": "out"
      }
    },
    {
      "id": "l0004.a0008",
      "kind": "devstone_atomic",
      "level": 4,
      "index": 8,
      "ports": {
        "input": "in",
        "output": "out"
      }
    },
    {
      "id": "l0004.a0009",
      "kind": "devstone_atomic",
      "level": 4,
      "index": 9,
      "ports": {
        "input": "in",
        "output": "out"
      }
    },
    {
      "id": "l0005.a0001",